{"authority":{"deployment":false,"production":false,"provider_transport":false,"tools":false},"checks":[{"check_id":"REQUIRED_ARTIFACTS","detail":"All required Factory handoff artifacts are present","status":"PASS"},{"check_id":"FACTORY_ROUTE","detail":"The certified build route passed before the independent review and packaging gates","status":"PASS"},{"check_id":"VERA_CERTIFICATION","detail":"Vera certified the deterministic local candidate","status":"PASS"},{"check_id":"BUILD_REPEATABILITY","detail":"Two Mason outputs matched and generated tests passed","status":"PASS"},{"check_id":"AUTHORITY_BOUNDARY","detail":"Deployment and production authority remain absent","status":"PASS"},{"check_id":"PROVIDER_BOUNDARY","detail":"The Factory mission used zero provider calls","status":"PASS"},{"check_id":"DECLARED_ARTIFACT_LEDGER","detail":"All 31 declared artifacts resolve inside the mission","status":"PASS"},{"check_id":"CREDENTIAL_CONTENT_GUARD","detail":"No credential-like content was found in the mission artifacts","status":"PASS"},{"check_id":"INDEPENDENT_TEST_RERUN","detail":"Independent generated-test rerun passed","status":"PASS"}],"created_at":"2026-08-26T01:41:42.812281+00:00","hermes_review":{"command":"/review verify every requirement was completed and look for anything that could break","packet":"governance/hermes-semantic-review-packet.v0.1.json","provider_calls":0,"status":"PREPARED_NOT_INVOKED"},"mission_id":"draft-ava-home-services-concierge-20260826-014140-bb4a8c","review_id":"local-review-f702d696b6bf4afc","review_sha256":"29f664a3847d2810503ef209ec286f47e5817504ad735692a74ccc4862cc84d3","reviewer":{"independent_from":["Atlas","Aria","Vera","Mason","Porter"],"mode":"INDEPENDENT_PROVIDER_FREE_REVIEW","name":"Rook","provider_calls":0},"schema_version":"0.1","source":{"build_root_digest":"f3c152d513b96bf12ba93fb249ea5b0d45934ee49b2d8d1aae09e343f751e12d","mission_record_sha256":"1331c062f4e20534e3c85df5fea20149b71a76d4a0748752f98564e7cb39b385"},"verdict":"READY_FOR_PORTER_PACKAGING"}
